{
  "$ref": "#/definitions/card-quote",
  "definitions": {
    "card-quote": {
      "type": "object",
      "properties": {
        "enabled": {
          "type": "boolean",
          "default": true
        },
        "order": {
          "type": "number",
          "default": 1
        },
        "position": {
          "type": "string",
          "enum": ["left", "right"],
          "default": "left"
        },
        "quotes_zh": {
          "type": "array",
          "items": {
            "type": "object",
            "properties": {
              "text": {
                "type": "string"
              },
              "author": {
                "type": "string"
              }
            },
            "required": ["text"],
            "additionalProperties": false
          }
        },
        "quotes_en": {
          "type": "array",
          "items": {
            "type": "object",
            "properties": {
              "text": {
                "type": "string"
              },
              "author": {
                "type": "string"
              }
            },
            "required": ["text"],
            "additionalProperties": false
          }
        },
        "$schema": {
          "type": "string"
        }
      },
      "additionalProperties": false
    }
  },
  "$schema": "http://json-schema.org/draft-07/schema#"
}
